NAMA,KOORDINAT,ALAMAT,KOTA,KECAMATAN,KELURAHAN
Oke Resto Wonogiri,"-7.8033451, 110.91393869999999","Kapten Tendean No.1, Wonokarto Barat, Wonokarto, Kec. Wonogiri, Kabupaten Wonogiri, Jawa Tengah 57612",KAB. WONOGIRI,Kec. Wonogiri,"Wonokarto Barat, Wonokarto"
Golden Resto Wonogiri,"-7.8569204, 110.90542529999999","RT.04/RW.02, Godean, Sendang, Kec. Wonogiri, Kabupaten Wonogiri, Jawa Tengah 57615",KAB. WONOGIRI,Kec. Wonogiri,"Wonokarto Barat, Wonokarto"
Emerald Resto Wonogiri,"-7.817647999999999, 110.925598","5WJG+X53, Kajen, Giripurwo, Kec. Wonogiri, Kabupaten Wonogiri, Jawa Tengah 57612",KAB. WONOGIRI,Kec. Wonogiri,"Wonokarto Barat, Wonokarto"
Pondok Makan Tebing Grenjengan,"-7.8550062, 110.9069411","Jajar, Sendang, Kec. Wonogiri, Kabupaten Wonogiri, Jawa Tengah 57615",KAB. WONOGIRI,Kec. Wonogiri,"Wonokarto Barat, Wonokarto"
Pondok Makan Murni Rasa Wonogiri,"-7.794055299999999, 110.9042333","6W43+9MH, Jalan Raya Solo - Krisak, Selogiri, Singodutan, Kec. Selogiri, Kabupaten Wonogiri, Jawa Tengah 57652",KAB. WONOGIRI,Kec. Wonogiri,"Wonokarto Barat, Wonokarto"
BERKAH RESTO WONOGIRI,"-7.8103245999999995, 110.94825739999999","PERUM. GRIYA CIPTALARAS BLOK E5, Bulusulur, Kec. Wonogiri, Kabupaten Wonogiri, Jawa Tengah 57611",KAB. WONOGIRI,Kec. Wonogiri,"Wonokarto Barat, Wonokarto"
Rumah Makan Sari Raras 1,"-7.8607141, 110.90213569999999","Jalan Raya Wonogiri-Praci KM, RW.8, Jajar, Sendang, Kec. Wonogiri, Kabupaten Wonogiri, Jawa Tengah 57615",KAB. WONOGIRI,Kec. Wonogiri,"Wonokarto Barat, Wonokarto"
Masakan Jawa Saraswati,"-7.8012808, 110.91053959999999","Jl. RM Said, RT.003/RW.011, Joho Lor, Giriwono, Kec. Wonogiri, Kabupaten Wonogiri, Jawa Tengah 57613",KAB. WONOGIRI,Kec. Wonogiri,"Wonokarto Barat, Wonokarto"
Berlian Kirana Resto,"-7.8154813, 110.9676473","Jl. Raya Wonogiri-Ponorogo No.725, Jatibedug, Purworejo, Kec. Wonogiri, Kabupaten Wonogiri, Jawa Tengah 57615",KAB. WONOGIRI,Kec. Wonogiri,"Wonokarto Barat, Wonokarto"
Resto HOHAH,"-7.8078806, 110.9162642","Jl. Gn. Butak, Joho Lor, Giriwono, Kec. Wonogiri, Kabupaten Wonogiri, Jawa Tengah 57613",KAB. WONOGIRI,Kec. Wonogiri,"Wonokarto Barat, Wonokarto"
RESTO JAWI,"-7.8175159999999995, 110.9772972","Brubuh Rt.04, RT.04/RW.01, Ngadirojo Lor, Kec. Ngadirojo, Kabupaten Wonogiri, Jawa Tengah 57681",KAB. WONOGIRI,Kec. Wonogiri,"Wonokarto Barat, Wonokarto"
Rumah Makan Kemuning,"-7.8167294, 110.9246994","Jalan Pelem 1 No.16, Kajen, Sabggrahan, Giripurwo, Kec. Wonogiri, Kabupaten Wonogiri, Jawa Tengah 57612",KAB. WONOGIRI,Kec. Wonogiri,"Wonokarto Barat, Wonokarto"
RM Prasmanan Alami Sayang 2,"-7.8175132, 110.97747609999999","6, Jl. Raya Wonogiri-Ponorogo No.KM, Brubuh, Ngadirojo Lor, Kec. Ngadirojo, Kabupaten Wonogiri, Jawa Tengah 57681",KAB. WONOGIRI,Kec. Wonogiri,"Wonokarto Barat, Wonokarto"
Rumah Makan Sari Rasa Bu Sayem,"-7.8245738, 110.9973789","Jalan Ngadirodjo - Baturetno KM. 1, Manggis, Ngadirojo, Manggis, Ngadirojo Kidul, Kec. Ngadirojo, Kabupaten Wonogiri, Jawa Tengah 57681",KAB. WONOGIRI,Kec. Wonogiri,"Wonokarto Barat, Wonokarto"
Larasati Steak & Resto,"-7.946031499999999, 111.0565209","Sembung, Tirtomoyo, Kec. Tirtomoyo, Kabupaten Wonogiri, Jawa Tengah 57672",KAB. WONOGIRI,Kec. Wonogiri,"Wonokarto Barat, Wonokarto"
Moengil Steak,"-7.8044894, 110.9173953","Jl. Jenderal Ahmad Yani No.31, Wonokarto Selatan, Wonokarto, Kec. Wonogiri, Kabupaten Wonogiri, Jawa Tengah 57613",KAB. WONOGIRI,Kec. Wonogiri,"Wonokarto Barat, Wonokarto"
Pak Glinding,"-7.859316199999999, 110.9034284","JL Raya Wonogiri - Pracimantoro, Km. 7, Jajar, Sendang, Kec. Wonogiri, Kabupaten Wonogiri, Jawa Tengah 57615",KAB. WONOGIRI,Kec. Wonogiri,"Wonokarto Barat, Wonokarto"
Chickentori,"-7.8135658999999995, 110.9273468","5WPG+HWH, Sabggrahan, Giripurwo, Kec. Wonogiri, Kabupaten Wonogiri, Jawa Tengah 57612",KAB. WONOGIRI,Kec. Wonogiri,"Wonokarto Barat, Wonokarto"
AmanisH Resto,"-7.0117186, 113.85492579999999","No.51Bangselok, Jl. KH. Wahid Hasyim, Pakalongan, Bangselok, Kec. Kota Sumenep, Kabupaten Sumenep, Jawa Timur 69417",KAB. SUMENEP,Kec. Kota Sumenep,"Karangdhalem, Karangduak"
Resto Ayam Brewok Sakera,"-7.0021236, 113.8595046","Jl. Pahlawan No.15, Karangdhalem, Karangduak, Kec. Kota Sumenep, Kabupaten Sumenep, Jawa Timur 69417",KAB. SUMENEP,Kec. Kota Sumenep,"Karangdhalem, Karangduak"
Melita Kitchen Resto,"-7.0154096, 113.86678309999999","Jl. DR. Cipto No.99, Gudang Dalam, Kolor, Kec. Kota Sumenep, Kabupaten Sumenep, Jawa Timur 69417",KAB. SUMENEP,Kec. Kota Sumenep,"Karangdhalem, Karangduak"
Rumah Makan Tiara,"-7.0118241, 113.8596584","Jl. Raya Pamekasan - Sumenep No.3, Lingkungan Dhalem, Pajagalan, Kec. Kota Sumenep, Kabupaten Sumenep, Jawa Timur 69416",KAB. SUMENEP,Kec. Kota Sumenep,"Karangdhalem, Karangduak"
Slopeng Beach Resto,"-6.8862869, 113.7941168","4Q7V+FJQ, Trebung Ghetteng, Sema""an, Kec. Dasuk, Kabupaten Sumenep, Jawa Timur 69454",KAB. SUMENEP,Kec. Kota Sumenep,"Karangdhalem, Karangduak"
Ananda Cafe & Resto,"-7.0290107, 113.85831239999999","Jl. Arya Wiraraja, Gedungan Timur, Gedungan, Kec. Batuan, Kabupaten Sumenep, Jawa Timur 69451",KAB. SUMENEP,Kec. Kota Sumenep,"Karangdhalem, Karangduak"
Ayoka Cafe & Kitchen,"-7.0131727999999995, 113.8633923","XVP7+P9J, Jl. Seludang, Lingkungan Dhalem, Pajagalan, Kec. Kota Sumenep, Kabupaten Sumenep, Jawa Timur 69417",KAB. SUMENEP,Kec. Kota Sumenep,"Karangdhalem, Karangduak"
Java In Coffee and Resto,"-7.020199, 113.8651897","Jl. Adirasa No.18, Kothe, Kolor, Kec. Kota Sumenep, Kabupaten Sumenep, Jawa Timur 69412",KAB. SUMENEP,Kec. Kota Sumenep,"Karangdhalem, Karangduak"
Babathia Food,"-7.018544899999999, 113.8624852","Jalan Potre Koneng II, Perum BSA Blok GB No. 31, Kothe, Kolor, Kec. Kota Sumenep, Kabupaten Sumenep, Jawa Timur 69417",KAB. SUMENEP,Kec. Kota Sumenep,"Karangdhalem, Karangduak"
Kedai HK,"-7.0214646, 113.85707","Jl. Trunojoyo No.5A, Kebun, Kolor, Kec. Kota Sumenep, Kabupaten Sumenep, Jawa Timur 69417",KAB. SUMENEP,Kec. Kota Sumenep,"Karangdhalem, Karangduak"
ALFA RESTO (BAKSO & SOTO KHAS KANGEAN),"-7.0150977, 113.8613877","XVM6+XH6, Gudang, Kolor, Kec. Kota Sumenep, Kabupaten Sumenep, Jawa Timur 69417",KAB. SUMENEP,Kec. Kota Sumenep,"Karangdhalem, Karangduak"
Lotus Cafe,"-7.0129633, 113.87364199999999","Jl. Kiyai H. Mansyur No.168, Podak, Pabian, Kec. Kota Sumenep, Kabupaten Sumenep, Jawa Timur 69417",KAB. SUMENEP,Kec. Kota Sumenep,"Karangdhalem, Karangduak"
Bebek Balap,"-7.0040625, 113.85908069999999","Jl. Pepaya No.25, Karangdhalem, Karangduak, Kec. Kota Sumenep, Kabupaten Sumenep, Jawa Timur 69417",KAB. SUMENEP,Kec. Kota Sumenep,"Karangdhalem, Karangduak"
Warung Tengah Sawah Sumenep,"-7.016774, 113.8538705","Kebun, Kolor, Kec. Kota Sumenep, Kabupaten Sumenep, Jawa Timur 69417",KAB. SUMENEP,Kec. Kota Sumenep,"Karangdhalem, Karangduak"
Aloska Cafe & Resto,"-7.051772499999999, 113.93814449999999","Jl. KH. Sujiono Waji, Kalianget Timur, East Kalianget, Kalianget, Sumenep Regency, East Java 69471",KAB. SUMENEP,Kec. Kota Sumenep,"Karangdhalem, Karangduak"
Steak 36 Sumenep,"-7.0060877999999995, 113.8569761","Jl. Diponegoro No.159, Barat Masjid, Karangduak, Kec. Kota Sumenep, Kabupaten Sumenep, Jawa Timur 69415",KAB. SUMENEP,Kec. Kota Sumenep,"Karangdhalem, Karangduak"
Tanean Sumenep (Eatery - Event Space - Library),"-6.9947403999999995, 113.8723234","DAM, Kebunan, Kec. Kota Sumenep, Kabupaten Sumenep, Jawa Timur 69412",KAB. SUMENEP,Kec. Kota Sumenep,"Karangdhalem, Karangduak"
RATU CABE,"-7.0045285999999995, 113.86841109999999","Jl. KH. Agus Salim, Pangarangan, Kec. Kota Sumenep, Kabupaten Sumenep, Jawa Timur",KAB. SUMENEP,Kec. Kota Sumenep,"Karangdhalem, Karangduak"
M2M Indonesian Fast food - Sumenep,"-7.0270886, 113.8542738","Jl. Raya Pamekasan - Sumenep, Gedungan Timur, Gedungan, Kec. Batuan, Kabupaten Sumenep, Jawa Timur 69451",KAB. SUMENEP,Kec. Kota Sumenep,"Karangdhalem, Karangduak"
Resto Kebun Ayu Banjarbaru,"-3.4527481, 114.851143","Jl. Bhayangkara, Kemuning, Kec. Banjarbaru Selatan, Kota Banjar Baru, Kalimantan Selatan 70714",KOTA BANJARBARU,Kec. Banjarbaru Utara,Loktabat Utara
Kampung Kecil Resto Banjarbaru,"-3.4386213, 114.84791729999999","Jl. A. Yani Jl. Batas Kota, Loktabat Utara, Kec. Banjarbaru Utara, Kota Banjar Baru, Kalimantan Selatan 70714",KOTA BANJARBARU,Kec. Banjarbaru Utara,Loktabat Utara
LUWEH CAFE N RESTO,"-3.4455175999999996, 114.83405119999999","Loktabat Sel., Kec. Banjarbaru Selatan, Kota Banjar Baru, Kalimantan Selatan 70714",KOTA BANJARBARU,Kec. Banjarbaru Utara,Loktabat Utara
RM Pondok Pisang,"-3.4343445999999997, 114.815376","Jl. Karang Anyar 1 No.20, Loktabat Utara, Kec. Banjarbaru Utara, Kota Banjar Baru, Kalimantan Selatan 70714",KOTA BANJARBARU,Kec. Banjarbaru Utara,Loktabat Utara
"Rumah Makan ""Swarga""","-3.4431819999999997, 114.831435","Jl. A. Yani No.KM.34 No.4, Guntung Paikat, Kec. Banjarbaru Selatan, Kota Banjar Baru, Kalimantan Selatan 70713",KOTA BANJARBARU,Kec. Banjarbaru Utara,Loktabat Utara
Black Orange Cafe & Seafood,"-3.4294328999999997, 114.8253314","HRCG+64G, Jl. Komp. Aulia Raya, Loktabat Utara, Kec. Banjarbaru Utara, Kota Banjar Baru, Kalimantan Selatan 70714",KOTA BANJARBARU,Kec. Banjarbaru Utara,Loktabat Utara
Pasta Joglo Banjar,"-3.4329144, 114.8125546","Komplek Villa Anyar Utama Komplek Villa Anyar Utama No. 30, Loktabat Utara, Kec. Banjarbaru Utara, Kota Banjar Baru, Kalimantan Selatan 70721",KOTA BANJARBARU,Kec. Banjarbaru Utara,Loktabat Utara
Daun Daun Le'Jardin,"-3.4306501, 114.8343084","HR9M+PPM, Loktabat Utara, Kec. Banjarbaru Utara, Kota Banjar Baru, Kalimantan Selatan 70714",KOTA BANJARBARU,Kec. Banjarbaru Utara,Loktabat Utara
Hijau Pandan Banjarbaru,"-3.4363552, 114.8453603","Jl. Rahayu, Loktabat Utara, Kec. Banjarbaru Utara, Kota Banjar Baru, Kalimantan Selatan 70714",KOTA BANJARBARU,Kec. Banjarbaru Utara,Loktabat Utara
Nyamsir,"-3.4439971999999996, 114.8317754","Jl. Kasturi Kel. Guntung Paikat No.3, Kecamatan, Kec. Banjarbaru Selatan, Kota Banjar Baru, Kalimantan Selatan 70713",KOTA BANJARBARU,Kec. Banjarbaru Utara,Loktabat Utara
Depot Sari Alam,"-3.4361604999999997, 114.83268899999999","HR7M+G3P, Jl. Pangeran Suriansyah, Loktabat Utara, Kec. Banjarbaru Utara, Kota Banjar Baru, Kalimantan Selatan 70711",KOTA BANJARBARU,Kec. Banjarbaru Utara,Loktabat Utara
Rumah Makan Pondok Garuda,"-3.4414989, 114.8392789","HR5Q+CP2, Jl. Garuda, Loktabat Utara, Kec. Banjarbaru Utara, Kota Banjar Baru, Kalimantan Selatan 70714",KOTA BANJARBARU,Kec. Banjarbaru Utara,Loktabat Utara
Waroeng Bamboe,"-3.4432445, 114.72447729999999","HP4F+PQ5, Landasan Ulin Bar., Kec. Liang Anggang, Kota Banjar Baru, Kalimantan Selatan 70723",KOTA BANJARBARU,Kec. Banjarbaru Utara,Loktabat Utara
Semua Senang (Pak Siyo),"-3.4490537, 114.7957727","Jalan A. Yani KM.30,5, Guntungmanggis, Kec. Landasan Ulin, Kota Banjar Baru, Kalimantan Selatan 70721",KOTA BANJARBARU,Kec. Banjarbaru Utara,Loktabat Utara
Pizza Hut - A. Yani,"-3.4432576, 114.8319511","Jl. A. Yani No.8A, Mentaos, Kec. Banjarbaru Selatan, Kota Banjar Baru, Kalimantan Selatan 70714",KOTA BANJARBARU,Kec. Banjarbaru Utara,Loktabat Utara
Tudung Saji Mama Lita,"-3.441954, 114.8328403","Loktabat Utara, Kec. Banjarbaru Utara, Kota Banjar Baru, Kalimantan Selatan 70714",KOTA BANJARBARU,Kec. Banjarbaru Utara,Loktabat Utara
RM Kabayan,"-3.4418756999999998, 114.8293545","Jl. Pangeran Hidayatullah No.7, Loktabat Utara, Kec. Banjarbaru Utara, Kota Banjar Baru, Kalimantan Selatan 70714",KOTA BANJARBARU,Kec. Banjarbaru Utara,Loktabat Utara
Gulaiku Banjarbaru,"-3.4417117999999998, 114.83283689999999","Jl. Pangeran Suriansyah No.6, Loktabat Utara, Banjarbaru Utara, Banjarbaru City, South Kalimantan",KOTA BANJARBARU,Kec. Banjarbaru Utara,Loktabat Utara
Warung Bewadah Banjarbaru,"-3.4647292, 114.8583463","Sungai Besar, Kec. Banjarbaru Selatan, Kota Banjar Baru, Kalimantan Selatan 70732",KOTA BANJARBARU,Kec. Banjarbaru Utara,Loktabat Utara
"WAROENG POJOK desa suka maju kecamatan Tambusai kab.Rokan Hulu, Riau","0.8395009999999999, 100.2880581","Suka Maju, Kec. Rambah, Kabupaten Rokan Hulu, Riau 28558",KAB. ROKAN HULU,Pematang Berangan,Jl. Tuanku Tambusai
HORE STEAK PASIR PANGARAIAN,"0.8896309, 100.30317679999999","V8Q3+V73, Jl. Tuanku Tambusai, Pematang Berangan, Kec. Rambah, Kabupaten Rokan Hulu, Riau 28557",KAB. ROKAN HULU,Pematang Berangan,Jl. Tuanku Tambusai
HBR Coffee & Resto,"0.8894267, 100.3037069","V8Q3+QFG, Pematang Berangan, Kec. Rambah, Kabupaten Rokan Hulu, Riau 28558",KAB. ROKAN HULU,Pematang Berangan,Jl. Tuanku Tambusai
cafe karet,"0.8837552, 100.2852178","V7MP+G34, Pematang Berangan, Kec. Rambah, Kabupaten Rokan Hulu, Riau 28558",KAB. ROKAN HULU,Pematang Berangan,Jl. Tuanku Tambusai
Cafe Cowboy Rohul,"0.8575541, 100.30405909999999","Jl. Diponegoro No.km1 No. 110, Pasir Pengaraian, Kec. Rambah, Kabupaten Rokan Hulu, Riau 28557",KAB. ROKAN HULU,Pematang Berangan,Jl. Tuanku Tambusai
RUMAH MAKAN SELERA BERSAMA,"0.8922777, 100.30720149999999","V8R4+WV8, Jl. Tuanku Tambusai, Pematang Berangan, Kec. Rambah, Kabupaten Rokan Hulu, Riau 28558",KAB. ROKAN HULU,Pematang Berangan,Jl. Tuanku Tambusai
Rumah Makan Sahabat Kita,"0.8636046, 100.2957735","V77W+C8R, Jl. Diponegoro, Pasir Pangarayan, Kec. Rambah, Kabupaten Rokan Hulu, Riau 28560",KAB. ROKAN HULU,Pematang Berangan,Jl. Tuanku Tambusai
Pondok ikan bakar mitra,"0.8446638, 100.3398296","Jl. Pasir Baru No.km 6, Pasir pengaraian, Pasirpangaraian, Kabupaten Rokan Hulu, Riau 28557",KAB. ROKAN HULU,Pematang Berangan,Jl. Tuanku Tambusai
RM RAMBAH JAYA,"0.8663563, 100.2947396","V78V+GVX, Jl. Tuanku Tambusai, Pasir Pengaraian, Kec. Rambah, Kabupaten Rokan Hulu, Riau 28550",KAB. ROKAN HULU,Pematang Berangan,Jl. Tuanku Tambusai
Pondok Berangin Mak Hilal,"0.8674358, 100.3043513","V883+XPH, Jl. Bukit Beringin, Pematang Berangan, Kec. Rambah, Kabupaten Rokan Hulu, Riau 28558",KAB. ROKAN HULU,Pematang Berangan,Jl. Tuanku Tambusai
RM COBEK Pasir Pangaraian,"0.8881591, 100.3002243","Jl. Tuanku Tambusai No.378, Pematang Berangan, Kec. Rambah, Kabupaten Rokan Hulu, Riau 28557",KAB. ROKAN HULU,Pematang Berangan,Jl. Tuanku Tambusai
RM. SELERA BERSAMA ( Rambah Hilir ),"0.9521014999999999, 100.3799712","X92H+RXX, Jl. Diponegoro, Rambah Hilir, Kec. Rambah Hilir, Kabupaten Rokan Hulu, Riau 28558",KAB. ROKAN HULU,Pematang Berangan,Jl. Tuanku Tambusai
MAJESTIC Coffee,"0.88371, 100.2974828","Pematang Berangan, Kec. Rambah, Kabupaten Rokan Hulu, Riau 28557",KAB. ROKAN HULU,Pematang Berangan,Jl. Tuanku Tambusai
Ikan Bakar Sasmita,"0.8455437, 100.34015149999999","Suka Maju, Kec. Rambah, Kabupaten Rokan Hulu, Riau 28557",KAB. ROKAN HULU,Pematang Berangan,Jl. Tuanku Tambusai
Rumah Makan Pondok Salimang,"0.5666614, 100.41357359999999","Jl. Kesehatan No.11, Rokan, Kec. Rokan IV Koto, Kabupaten Rokan Hulu, Riau 28555",KAB. ROKAN HULU,Pematang Berangan,Jl. Tuanku Tambusai
Cafe & Resto D' Puan,"0.7103322999999999, 100.54848009999999","PG6X+49Q, Jl. Setia Budi, Ngaso, Kec. Ujung Batu, Kabupaten Rokan Hulu, Riau 28557",KAB. ROKAN HULU,Pematang Berangan,Jl. Tuanku Tambusai
BAKSO PONDO,"0.8856265, 100.2983063","V7PX+783, Jl. Tuanku Tambusai, Pasir Pengaraian, Kec. Rambah, Kabupaten Rokan Hulu, Riau 28558",KAB. ROKAN HULU,Pematang Berangan,Jl. Tuanku Tambusai
Rumah Makan & Resto PAGI SORE,"0.863344, 100.2972063","V77W+8VP, Jl. Imam Bonjol, Pasir Pengaraian, Kec. Rambah, Kabupaten Rokan Hulu, Riau 28560",KAB. ROKAN HULU,Pematang Berangan,Jl. Tuanku Tambusai
Pondok Sate AWAL,"0.8655472, 100.29562659999999","V78W+676, Jl. Imam Bonjol, Pasir Pengaraian, Kec. Rambah, Kabupaten Rokan Hulu, Riau 28560",KAB. ROKAN HULU,Pematang Berangan,Jl. Tuanku Tambusai
Brother's Cafe & Resto,"-2.0153528, 119.2223435","X6MC+VW4, Tumbu, Kec. Topoyo, Kabupaten Mamuju Tengah, Sulawesi Barat 91563",KAB. MAMUJU TENGAH,Lembah Hopo,Jl. Poros Palu - Mamuju
"Rest Area Bukit Sengon, Karossa, Mamuju Tengah","-1.8133754, 119.40462219999999","5CP3+JRX, Jl. Poros Palu - Mamuju, Lembah Hopo, Kec. Karossa, Kabupaten Mamuju Tengah, Sulawesi Barat 91512",KAB. MAMUJU TENGAH,Lembah Hopo,Jl. Poros Palu - Mamuju
KONSPIRASI CAFE AND RESTO,"-2.073327, 119.2957479","W7GW+M79, Benteng, Kec. Topoyo, Kabupaten Mamuju Tengah, Sulawesi Barat 91563",KAB. MAMUJU TENGAH,Lembah Hopo,Jl. Poros Palu - Mamuju
RM Zalsabilah Prasmanan,"-1.9937673999999999, 119.32617499999999","284G+FFV, Kambunong, Kec. Karossa, Kabupaten Mamuju Tengah, Sulawesi Barat 91563",KAB. MAMUJU TENGAH,Lembah Hopo,Jl. Poros Palu - Mamuju
Rm. Sabar Menunggu Maah,"-1.7976653999999999, 119.40076769999999","6C22+W8V, Unnamed Road, Karossa, Kec. Karossa, Kabupaten Mamuju Tengah, Sulawesi Barat 91512",KAB. MAMUJU TENGAH,Lembah Hopo,Jl. Poros Palu - Mamuju
DM Steak,"-2.0683844, 119.28638699999999","W7JP+JHR, Topoyo, Kec. Topoyo, Kabupaten Mamuju Tengah, Sulawesi Barat",KAB. MAMUJU TENGAH,Lembah Hopo,Jl. Poros Palu - Mamuju
C'Bezt Friedchiken Mamuju Tengah,"-2.0784357, 119.29138909999999","W7CR+JHC, Tobadak, Kec. Tobadak, Kabupaten Mamuju, Sulawesi Barat 91563",KAB. MAMUJU TENGAH,Lembah Hopo,Jl. Poros Palu - Mamuju
Warung solo,"-1.8136052, 119.40401039999999","5CP3+HJ6, Jl. Poros Majene - Mamuju, Lembah Hopo, Kec. Karossa, Kabupaten Mamuju Tengah, Sulawesi Barat 91512",KAB. MAMUJU TENGAH,Lembah Hopo,Jl. Poros Palu - Mamuju
"RM. Karia Topoyo, Mamuju Tengah","-2.0707060999999998, 119.2866643","W7HP+PM7, Jl. Jenderal Sudirman, Topoyo, Kec. Topoyo, Kabupaten Mamuju Tengah, Sulawesi Barat 91563",KAB. MAMUJU TENGAH,Lembah Hopo,Jl. Poros Palu - Mamuju
Warung sejawakah 02,"-2.0187683, 119.31988829999999","X8J9+FXR, Salupangkang, Kec. Topoyo, Kabupaten Mamuju Tengah, Sulawesi Barat 91563",KAB. MAMUJU TENGAH,Lembah Hopo,Jl. Poros Palu - Mamuju
Cahaya Tobinta,"-1.9644401999999999, 119.3284352","28PH+69F, Jl. Poros Majene - Mamuju, Kambunong, Kec. Karossa, Kabupaten Mamuju Tengah, Sulawesi Barat 91563",KAB. MAMUJU TENGAH,Lembah Hopo,Jl. Poros Palu - Mamuju
Warung Mas Ju,"-2.0700518999999997, 119.28645949999999","Topoyo, Kec. Topoyo, Kabupaten Mamuju Tengah, Sulawesi Barat 91563",KAB. MAMUJU TENGAH,Lembah Hopo,Jl. Poros Palu - Mamuju
Warung Shofi,"-2.042163, 119.272427","X74C+JVX, Waeputeh, Kec. Topoyo, Kabupaten Mamuju Tengah, Sulawesi Barat 91563",KAB. MAMUJU TENGAH,Lembah Hopo,Jl. Poros Palu - Mamuju
Villa riverside kafe &resto,"-2.063211, 119.29905079999999","W7PX+M96, Topoyo, Kec. Topoyo, Kabupaten Mamuju Tengah, Sulawesi Barat 91563",KAB. MAMUJU TENGAH,Lembah Hopo,Jl. Poros Palu - Mamuju
Rumah Makan Arum Dallu (Mas Djoko) Lamongan,"-2.0712650999999997, 119.28712209999999","W7HP+FRX, Topoyo, Kec. Topoyo, Kabupaten Mamuju Tengah, Sulawesi Barat 91563",KAB. MAMUJU TENGAH,Lembah Hopo,Jl. Poros Palu - Mamuju
Warung Citra Gigi,"-1.7982471999999998, 119.4017647","6C22+PP2, Karossa, Kec. Karossa, Kabupaten Mamuju Tengah, Sulawesi Barat 91512",KAB. MAMUJU TENGAH,Lembah Hopo,Jl. Poros Palu - Mamuju
ika hasan,"-2.0507725, 119.3120809","W8X6+MRW, Tabolang, Kec. Topoyo, Kabupaten Mamuju Tengah, Sulawesi Barat 91563",KAB. MAMUJU TENGAH,Lembah Hopo,Jl. Poros Palu - Mamuju
"Kedai ""mie ayang"" Mbak Erna","-2.1813936, 119.22863969999999","R69H+5G2, Tinali, Kec. Budong-Budong, Kabupaten Mamuju Tengah, Sulawesi Barat 91563",KAB. MAMUJU TENGAH,Lembah Hopo,Jl. Poros Palu - Mamuju
Rumah Makan Antalili,"-1.998117, 119.323765","282F+QG2, Jl. Poros Majene - Mamuju, Kambunong, Kec. Karossa, Kabupaten Mamuju Tengah, Sulawesi Barat 91563",KAB. MAMUJU TENGAH,Lembah Hopo,Jl. Poros Palu - Mamuju
The Malinan Kei Islands Resto and Cafe,"-5.6462414, 132.73933259999998","Jl. Raya Merdeka, Kel. Ohoijang Watdek, Kec. Kei Kecil, Kabupaten Maluku Tenggara, Maluku",KAB. MALUKU TENGGARA,Ohoidertawun,"JL. Jend Sudirman, Watdek Ohoiyong, Kei Kecil"
Charlie Restaurant,"-5.637468, 132.66223","9M76+2V9, JL. Jend Sudirman, Watdek Ohoiyong, Kei Kecil, Ohoidertawun, Tual, Kabupaten Maluku Tenggara, Maluku 97611",KAB. MALUKU TENGGARA,Ohoidertawun,"JL. Jend Sudirman, Watdek Ohoiyong, Kei Kecil"
Forganza Resto & Cafe,"-5.6575049, 132.7029619","Kelanit, Kec. Kei Kecil, Kabupaten Maluku Tenggara, Maluku",KAB. MALUKU TENGGARA,Ohoidertawun,"JL. Jend Sudirman, Watdek Ohoiyong, Kei Kecil"
CC Cafe,"-5.6576723, 132.7400104","Ohoibun, Jl. Jend. Sudirman, Langgur, Kec. Kei Kecil, Kabupaten Maluku Tenggara, Maluku 90611",KAB. MALUKU TENGGARA,Ohoidertawun,"JL. Jend Sudirman, Watdek Ohoiyong, Kei Kecil"
Kimson Resto,"-5.6474489, 132.7380365","9P3Q+26F, Kel. Ohoijang Watdek, Kec. Kei Kecil, Kabupaten Maluku Tenggara, Maluku",KAB. MALUKU TENGGARA,Ohoidertawun,"JL. Jend Sudirman, Watdek Ohoiyong, Kei Kecil"
WARUNG MBAKZUL,"-5.647638199999999, 132.7378057","9P2Q+W4V, Jl. Raya Merdeka, Kel. Ohoijang Watdek, Kec. Kei Kecil, Kabupaten Maluku Tenggara, Maluku",KAB. MALUKU TENGGARA,Ohoidertawun,"JL. Jend Sudirman, Watdek Ohoiyong, Kei Kecil"
RM MBAK NUR,"-5.646807099999999, 132.7412161","Jl. Jend. Sudirman, Kel. Ohoijang Watdek, Kec. Kei Kecil, Kabupaten Maluku Tenggara, Maluku",KAB. MALUKU TENGGARA,Ohoidertawun,"JL. Jend Sudirman, Watdek Ohoiyong, Kei Kecil"
Sari Minang,"-5.6473512999999995, 132.7413498","Jl. Jend. Sudirman No.26, Kel. Ohoijang Watdek, Kec. Kei Kecil, Kabupaten Maluku Tenggara, Maluku 97611",KAB. MALUKU TENGGARA,Ohoidertawun,"JL. Jend Sudirman, Watdek Ohoiyong, Kei Kecil"
RM.Fahry,"-5.6502053, 132.7337322","8PXM+WF9, Perumnas, Kel. Ohoijang Watdek, Kec. Kei Kecil, Kabupaten Maluku Tenggara, Maluku",KAB. MALUKU TENGGARA,Ohoidertawun,"JL. Jend Sudirman, Watdek Ohoiyong, Kei Kecil"
RM. Eka Seafood 1,"-5.647278699999999, 132.7385496","9P3Q+3CM, Jl. Raya Merdeka, Kel. Ohoijang Watdek, Kec. Kei Kecil, Kabupaten Maluku Tenggara, Maluku",KAB. MALUKU TENGGARA,Ohoidertawun,"JL. Jend Sudirman, Watdek Ohoiyong, Kei Kecil"
Warung Saraba,"-5.6440715, 132.7420128","9P4R+9RC, Jl. Trikora, Kel. Ohoijang Watdek, Kec. Kei Kecil, Kabupaten Maluku Tenggara, Maluku",KAB. MALUKU TENGGARA,Ohoidertawun,"JL. Jend Sudirman, Watdek Ohoiyong, Kei Kecil"
Ayam Gepuk Pak Gembus,"-5.6717249, 132.7374803","8PHQ+C49, Langgur, Kei Kecil, Sotheast Maluku Regency, Maluku",KAB. MALUKU TENGGARA,Ohoidertawun,"JL. Jend Sudirman, Watdek Ohoiyong, Kei Kecil"
Rumah Makan Fair,"-5.646030199999999, 132.7394477","9P3Q+HQP, Kel. Ohoijang Watdek, Kec. Kei Kecil, Kabupaten Maluku Tenggara, Maluku",KAB. MALUKU TENGGARA,Ohoidertawun,"JL. Jend Sudirman, Watdek Ohoiyong, Kei Kecil"
Rumah Makan Lor Nidi,"-5.7761007, 132.7888365","6QFQ+FC, Wain, Sotheast Maluku Regency, Maluku",KAB. MALUKU TENGGARA,Ohoidertawun,"JL. Jend Sudirman, Watdek Ohoiyong, Kei Kecil"
Ten Cafe,"-5.66747, 132.6348318","8JMM+2W8, Ngilngof, Kec. Kei Kecil, Kabupaten Maluku Tenggara, Maluku",KAB. MALUKU TENGGARA,Ohoidertawun,"JL. Jend Sudirman, Watdek Ohoiyong, Kei Kecil"
RUMAH MAKAN MINANG ASLI,"-5.672058799999999, 132.73561709999998","Jl. Kabupaten, Faan, Kec. Kei Kecil, Kabupaten Maluku Tenggara, Maluku",KAB. MALUKU TENGGARA,Ohoidertawun,"JL. Jend Sudirman, Watdek Ohoiyong, Kei Kecil"
Warung Sarilaut Mas Joko,"-5.6493702, 132.7412317","9P2R+7F5, Kel. Ohoijang Watdek, Kec. Kei Kecil, Kabupaten Maluku Tenggara, Maluku",KAB. MALUKU TENGGARA,Ohoidertawun,"JL. Jend Sudirman, Watdek Ohoiyong, Kei Kecil"
Viera Café & Resto,"-5.6625795, 132.6367757","8JPP+XP6, Ohoililir, Kec. Kei Kecil, Kabupaten Maluku Tenggara, Maluku",KAB. MALUKU TENGGARA,Ohoidertawun,"JL. Jend Sudirman, Watdek Ohoiyong, Kei Kecil"
Warung Makan Jawa Timur,"-5.6502764999999995, 132.733174","8PXM+V7M, Kel. Ohoijang Watdek, Kec. Kei Kecil, Kabupaten Maluku Tenggara, Maluku",KAB. MALUKU TENGGARA,Ohoidertawun,"JL. Jend Sudirman, Watdek Ohoiyong, Kei Kecil"
Alim Seafood Restaurant/ Hotel Melia,"0.9322146, 104.4404531","Jl. Pos No.6, Tanjungpinang Kota, Kec. Tj. Pinang Kota, Kota Tanjung Pinang, Kepulauan Riau",KOTA TANJUNG PINANG,Tanjung Pinang Kota,Tanjungpinang Kota
Api Biru Bar & Seafood Restaurant,"0.9249856, 104.4387764","Jl. Hang Tuah, Tanjungpinang Kota, Tanjung Pinang Kota, Tanjung Pinang City, Riau Islands 29111",KOTA TANJUNG PINANG,Tanjung Pinang Kota,Tanjungpinang Kota
Depot Bumi Maitri,"0.9112465, 104.45784859999999","JL. Ir. Sutami, No. 168, Tj. Pinang Timur, Kec. Bukit Bestari, Kota Tanjung Pinang, Kepulauan Riau 29112",KOTA TANJUNG PINANG,Tanjung Pinang Kota,Tanjungpinang Kota
Sweet Resto,"0.9274302999999999, 104.44557909999999","Jl. Bakar Batu No.102 C, Kemboja, Kec. Tanjungpinang Bar., Kota Tanjung Pinang, Kepulauan Riau 29112",KOTA TANJUNG PINANG,Tanjung Pinang Kota,Tanjungpinang Kota
The Manabu Bintan,"0.9259672, 104.4382902","Jl.Hang Tuah No.17 Sadaap, Tepi Laut, Kec. Tj. Pinang Kota, Kota Tanjung Pinang, Kepulauan Riau 29111",KOTA TANJUNG PINANG,Tanjung Pinang Kota,Tanjungpinang Kota
Restaurant Singgah Selalu,"0.9068067, 104.4590635","Jl. Basuki Rahmat, Tj. Ayun Sakti, Kec. Bukit Bestari, Kota Tanjung Pinang, Kepulauan Riau 29113",KOTA TANJUNG PINANG,Tanjung Pinang Kota,Tanjungpinang Kota
Restoran Sei Enam,"0.9143142, 104.43811319999999","Pantai Teluk Keriting, Jl. Usman Harun No.31, Kec. Tanjungpinang Bar., Kota Tanjung Pinang, Kepulauan Riau",KOTA TANJUNG PINANG,Tanjung Pinang Kota,Tanjungpinang Kota
Sam's Anna Seafood,"0.9056742, 104.4451429","Jalan Yos Sudarso Gang, Jl. Jahan II, RT.03/RW.02, Kp. Baru, Kec. Tanjungpinang Bar., Kota Tanjung Pinang, Kepulauan Riau 29112",KOTA TANJUNG PINANG,Tanjung Pinang Kota,Tanjungpinang Kota
Arabian Store Tanjungpinang,"0.9236652, 104.450221","pas seberang Cafe Puncak, Jl. Puncak, Jl. Bukit Cermin atas No.15, Kepulauan Riau 29112",KOTA TANJUNG PINANG,Tanjung Pinang Kota,Tanjungpinang Kota
Sam's Anna Restaurant,"0.9158073999999999, 104.4522739","WF82+8WC, Tj. Pinang Timur, Kec. Bukit Bestari, Kota Tanjung Pinang, Kepulauan Riau 29112",KOTA TANJUNG PINANG,Tanjung Pinang Kota,Tanjungpinang Kota
Rumah Makan Sederhana,"0.927689, 104.4388173","Jl. Hang Tuah Raya No.11, Tanjungpinang Kota, Kec. Tj. Pinang Kota, Kota Tanjung Pinang, Kepulauan Riau 29125",KOTA TANJUNG PINANG,Tanjung Pinang Kota,Tanjungpinang Kota
Dimas Resto,"0.9234083999999999, 104.4717912","Jl. Sultan Sulaiman No.01, RT.01/RW.09, Kampung Bulang, Tanjungpinang Timur, Tanjung Pinang City, Riau Islands 29122",KOTA TANJUNG PINANG,Tanjung Pinang Kota,Tanjungpinang Kota
