NAMA,KOORDINAT,ALAMAT,KOTA,KECAMATAN,KELURAHAN
Fabrica Bar & Eatery,"0.9278164, 104.4531372","WFH3+47C, Rimba Jaya, Jl. Gudang Minyak, Kemboja, Kec. Tanjungpinang Bar., Kota Tanjung Pinang, Kepulauan Riau 29115",KOTA TANJUNG PINANG,Tanjung Pinang Kota,Tanjungpinang Kota
Bata Merah Resto,"0.9092291, 104.4640706","WF57+MJW, Jl. Raja Ali H., Tj. Ayun Sakti, Kec. Bukit Bestari, Kota Tanjung Pinang, Kepulauan Riau 29122",KOTA TANJUNG PINANG,Tanjung Pinang Kota,Tanjungpinang Kota
Surya Indah Seafood Restaurant,"0.8969263, 104.4698852","Jl Seijang N0. 06 Restoran Seafood Surya Indah, Tanjung Pinang City, Riau Islands 29124",KOTA TANJUNG PINANG,Tanjung Pinang Kota,Tanjungpinang Kota
TOMO,"0.9288242999999999, 104.452964","Jl. Gudang Minyak No.133, Rimba Jaya, Kec. Tanjungpinang Bar., Kota Tanjung Pinang, Kepulauan Riau 29112",KOTA TANJUNG PINANG,Tanjung Pinang Kota,Tanjungpinang Kota
Pasta Kangen Tanjung Pinang,"0.9072969, 104.4519345","Jl. Wiratno No.7B, Kp. Baru, Kec. Tanjungpinang Bar., Kota Tanjung Pinang, Kepulauan Riau 29112",KOTA TANJUNG PINANG,Tanjung Pinang Kota,Tanjungpinang Kota
Pondok Ciung Ikan Bakar,"0.9170425999999999, 104.4695369","Jl. Gatot Subroto Km. 5 Bawah, Kampung Bulang, Tanjungpinang Timur, Kp. Bulang, Kec. Tanjungpinang Tim., Kota Tanjung Pinang, Kepulauan Riau 29122",KOTA TANJUNG PINANG,Tanjung Pinang Kota,Tanjungpinang Kota
Ok Bento Tanjungpinang,"0.9117649, 104.4612264","WF66+PF5, Jl. Ir. Sutami, Tanjung Ayun Sakti, Bukit Bestari, Tanjung Pinang City, Riau Islands 29122",KOTA TANJUNG PINANG,Tanjung Pinang Kota,Tanjungpinang Kota
